,Symbol,Security Name
2006,OPP$A,"RiverNorth/DoubleLine Strategic Opportunity Fund, Inc. 4.375% Series A Cumulative Preferred Stock"
2007,OPP$B,"RiverNorth/DoubleLine Strategic Opportunity Fund, Inc. 4.75% Series B Cumulative Preferred Stock"
2008,OPY,"Oppenheimer Holdings, Inc. Class A Common Stock (DE)"
2009,OR,Osisko Gold Royalties Ltd Common Shares
2010,ORA,"Ormat Technologies, Inc. Common Stock"
2011,ORAN,Orange
2012,ORC,"Orchid Island Capital, Inc. Common Stock"
2013,ORCL,Oracle Corporation Common Stock
2014,ORI,Old Republic International Corporation Common Stock
2015,ORN,"Orion Group Holdings, Inc. Common"
2016,OSCR,"Oscar Health, Inc. Class A Common Stock"
2017,OSK,Oshkosh Corporation (Holding Company)Common Stock
2018,OTIS,Otis Worldwide Corporation Common Stock 
2019,OUST,"Ouster, Inc. Common Stock"
2020,OUST.W,"Ouster, Inc. Warrants"
2021,OUT,OUTFRONT Media Inc. Common Stock
2022,OVV,Ovintiv Inc. (DE)
2023,OWL,Blue Owl Capital Inc. Class A Common Stock
2024,OWLT,"Owlet, Inc. Class A Common Stock"
2025,OXM,"Oxford Industries, Inc. Common Stock"
2026,OXY,Occidental Petroleum Corporation Common Stock
2027,OXY.W,Occidental Petroleum Corporation Warrants 
2028,PAAS,Pan American Silver Corp. Common Stock
2029,PAC,"Grupo Aeroportuario Del Pacifico, S.A. B. de C.V. Grupo Aeroportuario Del Pacifico, S.A. de C.V. (each representing 10 Series B shares)"
2030,PACK,Ranpak Holdings Corp Class A Common Stock
2031,PACS,"PACS Group, Inc. Common Stock"
2032,PAG,"Penske Automotive Group, Inc. Common Stock"
2033,PAGS,PagSeguro Digital Ltd. Class A Common Shares
2034,PAI,Western Asset Investment Grade Income Fund Inc.
2035,PAM,Pampa Energia S.A.
2036,PAR,PAR Technology Corporation Common Stock
2037,PARR,"Par Pacific Holdings, Inc.  Common Stock"
2038,PATH,"UiPath, Inc. Class A Common Stock"
2039,PAXS,PIMCO Access Income Fund Common Shares of Beneficial Interest
2040,PAY,"Paymentus Holdings, Inc. Class A Common Stock"
2041,PAYC,"Paycom Software, Inc. Common Stock"
2042,PB,"Prosperity Bancshares, Inc. Common Stock"
2043,PBA,Pembina Pipeline Corp. Ordinary Shares (Canada)
2044,PBF,PBF Energy Inc. Class A Common Stock
2045,PBH,Prestige Consumer Healthcare Inc. Common Stock
2046,PBI,Pitney Bowes Inc. Common Stock
2047,PBI$B,Pitney Bowes Inc 6.70% Notes Due 2043
2048,PBR,Petroleo Brasileiro S.A.- Petrobras Common Stock
2049,PBR.A,Petroleo Brasileiro S.A.- Petrobras American Depositary Shares
2050,PBT,Permian Basin Royalty Trust Common Stock
2051,PCF,High Income Securities Fund Common Stock
2052,PCG,Pacific Gas & Electric Co. Common Stock
2053,PCK,Pimco California Municipal Income Fund II Common Shares of Beneficial Interest
2054,PCM,"PCM Fund, Inc. Common Stock"
2055,PCN,Pimco Corporate & Income Strategy Fund Common Stock
2056,PCOR,"Procore Technologies, Inc. Common Stock"
2057,PCQ,PIMCO California Municipal Income Fund Common Stock
2058,PD,"PagerDuty, Inc. Common Stock"
2059,PDCC,Pearl Diver Credit Company Inc. Common Stock
2060,PDI,PIMCO Dynamic Income Fund Common Stock
2061,PDM,"Piedmont Office Realty Trust, Inc. Class A Common Stock"
2062,PDO,PIMCO Dynamic Income Opportunities Fund Common Shares of Beneficial Interest
2063,PDS,Precision Drilling Corporation Common Stock
2064,PDT,John Hancock Premium Dividend Fund
2065,PDX,PIMCO Dynamic Income Strategy Fund Common Shares of Beneficial Interest
2066,PEB,Pebblebrook Hotel Trust Common Shares of Beneficial Interest
2067,PEB$E,Pebblebrook Hotel Trust 6.375% Series E Cumulative Redeemable Preferred Shares of Beneficial Interest
2068,PEB$F,Pebblebrook Hotel Trust 6.3% Series F Cumulative Redeemable Preferred Shares of Beneficial Interest
2069,PEB$G,Pebblebrook Hotel Trust 6.375% Series G Cumulative Redeemable Preferred Shares of Beneficial Interest
2070,PEB$H,Pebblebrook Hotel Trust 5.700% Series H Cumulative Redeemable Preferred Shares of Beneficial Interest
2071,PEG,Public Service Enterprise Group Incorporated Common Stock
2072,PEN,"Penumbra, Inc. Common Stock"
2073,PEO,"Adams Natural Resources Fund, Inc. Common Stock"
2074,PERF,Perfect Corp. Class A Ordinary Share
2075,PERF.W,"Perfect Corp. Warrants, each exercisable for one Class A Ordinary Share at a price of $11.50 per share"
2076,PFD,Flaherty & Crumrine Preferred and Income Fund Incorporated
2077,PFE,"Pfizer, Inc. Common Stock"
2078,PFGC,Performance Food Group Company Common Stock
2079,PFH,"Prudential Financial, Inc. 4.125% Junior Subordinated Notes due 2060"
2080,PFL,PIMCO Income Strategy Fund Shares of Beneficial Interest
2081,PFLT,PennantPark Floating Rate Capital Ltd. Common Stock
2082,PFN,PIMCO Income Strategy Fund II
2083,PFO,Flaherty & Crumrine Preferred and Income Opportunity Fund Incorporated
2084,PFS,"Provident Financial Services, Inc Common Stock"
2085,PFSI,"PennyMac Financial Services, Inc. Common Stock"
2086,PG,Procter & Gamble Company (The) Common Stock
2087,PGP,Pimco Global StocksPlus & Income Fund Common Shares of Beneficial Interest
2088,PGR,Progressive Corporation (The) Common Stock
2089,PGRE,"Paramount Group, Inc. Common Stock"
2090,PGRU,PropertyGuru Group Limited Ordinary Shares
2091,PGZ,Principal Real Estate Income Fund Common Shares of Beneficial Interest
2092,PH,Parker-Hannifin Corporation Common Stock
2093,PHD,"Pioneer Floating Rate Fund, Inc."
2094,PHG,Koninklijke Philips N.V. NY Registry Shares
2095,PHI,PLDT Inc. Sponsored ADR
2096,PHIN,PHINIA Inc. Common Stock
2097,PHK,Pimco High Income Fund
2098,PHM,"PulteGroup, Inc. Common Stock"
2099,PHR,"Phreesia, Inc. Common Stock"
2100,PHT,"Pioneer High Income Fund, Inc."
2101,PHX,PHX Minerals Inc. Common Stock
2102,PHYT,Pyrophyte Acquisition Corp. Class A Ordinary Shares
2103,PHYT.U,"Pyrophyte Acquisition Corp. Units, each consisting of one share of Class A common stock and one-half of one redeemable warrant"
2104,PHYT.W,"Pyrophyte Acquisition Corp. Warrants, each whole warrant exercisable for one Class A ordinary share at an exercise price of $11.50 per share"
2105,PII,Polaris Inc. Common Stock
2106,PIM,Putnam Master Intermediate Income Trust Common Stock
2107,PINE,"Alpine Income Property Trust, Inc. Common Stock"
2108,PINS,"Pinterest, Inc. Class A Common Stock"
2109,PIPR,Piper Sandler Companies Common Stock
2110,PJT,PJT Partners Inc. Class A Common Stock
2111,PK,Park Hotels & Resorts Inc. Common Stock 
2112,PKE,Park Aerospace Corp. Common Stock
2113,PKG,Packaging Corporation of America Common Stock
2114,PKST,Peakstone Realty Trust Common Shares
2115,PKX,POSCO Holdings Inc. American Depositary Shares (Each representing 1/4th of a share of Common Stock)
2116,PL,Planet Labs PBC Class A Common Stock
2117,PL.W,"Planet Labs PBC Redeemable warrants, each whole warrant exercisable for one share of Class A common stock, each at an exercise price of $11.50 per share"
2118,PLD,"Prologis, Inc. Common Stock"
2119,PLNT,"Planet Fitness, Inc. Common Stock"
2120,PLOW,"Douglas Dynamics, Inc. Common Stock"
2121,PLTR,Palantir Technologies Inc. Class A Common Stock
2122,PLYM,"Plymouth Industrial REIT, Inc. Common Stock"
2123,PM,Philip Morris International Inc Common Stock
2124,PMF,PIMCO Municipal Income Fund Common Stock
2125,PML,Pimco Municipal Income Fund II Common Shares of Beneficial Interest
2126,PMM,Putnam Managed Municipal Income Trust Common Stock
2127,PMO,Putnam Municipal Opportunities Trust Common Stock
2128,PMT,PennyMac Mortgage Investment Trust Common Shares of Beneficial Interest
2129,PMT$A,PennyMac Mortgage Investment Trust 8.125% Series A Fixed-to-Floating Rate Cumulative Redeemable Preferred Shares of Beneficial Interest
2130,PMT$B,PennyMac Mortgage Investment Trust 8.00% Series B Fixed-to-Floating Rate Cumulative Redeemable Preferred Shares of Beneficial Interest
2131,PMT$C,PennyMac Mortgage Investment Trust 6.75% Series C Cumulative Redeemable Preferred Shares of Beneficial Interest
2132,PMTU,PennyMac Mortgage Investment Trust 8.50% Senior Notes due 2028
2133,PMX,PIMCO Municipal Income Fund III Common Shares of Beneficial Interest
2134,PNC,"PNC Financial Services Group, Inc. (The) Common Stock"
2135,PNF,PIMCO New York Municipal Income Fund Common Stock
2136,PNI,Pimco New York Municipal Income Fund II Common Shares of Beneficial Interest
2137,PNNT,PennantPark Investment Corporation Common Stock
2138,PNR,Pentair plc. Ordinary Share
2139,PNST,"Pinstripes Holdings, Inc. Class A Common Stock"
2140,PNST.W,"Pinstripes Holdings, Inc. Warrants, each whole warrant exercisable for one share of Class A common stock at an exercise price of $11.50 per share"
2141,PNW,Pinnacle West Capital Corporation Common Stock
2142,POR,Portland General Electric Co Common Stock
2143,POST,"Post Holdings, Inc. Common Stock"
2144,PPG,"PPG Industries, Inc. Common Stock"
2145,PPL,PPL Corporation Common Stock
2146,PPT,Putnam Premier Income Trust Common Stock
2147,PR,Permian Resources Corporation Class A Common Stock
2148,PRA,ProAssurance Corporation Common Stock
2149,PRG,"PROG Holdings, Inc. Common Stock"
2150,PRGO,Perrigo Company plc Ordinary Shares
2151,PRH,"Prudential Financial, Inc. 5.950% Junior Subordinated Notes due 2062"
2152,PRI,"Primerica, Inc. Common Stock"
2153,PRIF$D,"Priority Income Fund, Inc. 7.00% Series D Term Preferred Stock due 2029"
2154,PRIF$F,"Priority Income Fund, Inc. 6.625% Series F Term Preferred Stock due 2027"
2155,PRIF$G,"Priority Income Fund, Inc. 6.25% Series G Preferred Stock Due 2026"
2156,PRIF$H,"Priority Income Fund, Inc. 6.00% Series H Term Preferred Stock due 2026"
2157,PRIF$I,"Priority Income Fund, Inc. 6.125% Series I Term Preferred Stock due 2028"
2158,PRIF$J,"Priority Income Fund, Inc. 6.000% Series J Term Preferred Stock due 2028"
2159,PRIF$K,"Priority Income Fund, Inc. 7.000% Series K Cumulative Preferred Stock"
2160,PRIF$L,"Priority Income Fund, Inc. 6.375% Series L Term Preferred Stock Due 2029"
2161,PRIM,Primoris Services Corporation Common Stock
2162,PRKS,United Parks & Resorts Inc. Common Stock
2163,PRLB,"Proto Labs, Inc. Common stock"
2164,PRM,"Perimeter Solutions, SA Ordinary Shares"
2165,PRMW,Primo Water Corporation Common Stock
2166,PRO,"PROS Holdings, Inc. Common Stock"
2167,PRS,"Prudential Financial, Inc. 5.625% Junior Subordinated Notes due 2058"
2168,PRT,PermRock Royalty Trust Trust Units
2169,PRU,"Prudential Financial, Inc. Common Stock"
2170,PSA,Public Storage Common Stock
2171,PSA$F,"Public Storage Depositary Shares Each Representing 1/1,000 of a 5.15% Cumulative Preferred Share of Beneficial Interest, Series F, par value $0.01 per share"
2172,PSA$G,"Public Storage Depositary Shares, Each Representing 1/1,000 of a 5.05% Cumulative Preferred Share of Beneficial Interest, Series G"
2173,PSA$H,"Public Storage Depositary Shares Each Representing 1/1,000 of a  5.60% Cumulative Preferred  Share of Beneficial Interest, Series H"
2174,PSA$I,"Public Storage Depositary Shares Each Representing 1/1,000 of a 4.875% Cumulative Preferred Share of Beneficial Interest, Series I, par value $0.01 per share"
2175,PSA$J,"Public Storage Depositary Shares Each Representing 1/1,000 of a 4.700% Cumulative Preferred Share of Beneficial Interest, Series J, par value $0.01 per share"
2176,PSA$K,"Public Storage Depositary Shares Each Representing 1/1,000 of a 4.75% Cumulative Preferred Share of Beneficial Interest, Series K"
2177,PSA$L,"Public Storage Depositary Shares Each Representing 1/1,000 of a 4.625% Cumulative Preferred Share of Beneficial Interest, Series L, par value $0.01 per share"
2178,PSA$M,"Public Storage Depositary Shares Each Representing 1/1,000 of a 4.125% Cumulative Preferred Share of Beneficial Interest, Series M"
2179,PSA$N,"Public Storage Depositary Shares Each Representing 1/1,000 of a 3.875% Cumulative Preferred Share of Beneficial Interest, Series N"
2180,PSA$O,"Public Storage Depositary Shares Each Representing 1/1,000 of a 3.900% Cumulative Preferred Share of Beneficial Interest, Series O"
2181,PSA$P,"Public Storage Depositary Shares Each Representing 1/1,000 of a 4.000% Cumulative Preferred Share of Bene cial Interest, Series P"
2182,PSA$Q,"Public Storage Depositary Shares Each Representing 1/1,000 of a 3.950% Cumulative Preferred Share of Beneficial Interest, Series Q, par value $0.01 per share"
2183,PSA$R,"Public Storage Depositary Shares Each Representing 1/1,000 of a 4.00% Cumulative Preferred Share of Bene cial Interest, Series R"
2184,PSA$S,"Public Storage Depositary Shares Each Representing 1/1,000 of a 4.100% Cumulative Preferred Share of Beneficial Interest, Series S"
2185,PSBD,Palmer Square Capital BDC Inc. Common Stock
2186,PSEC$A,Prospect Capital Corporation 5.35% Series A Fixed Rate Cumulative Perpetual Preferred Stock
2187,PSF,"Cohen & Steers Select Preferred and Income Fund, Inc. Common Stock"
2188,PSFE,Paysafe Limited Common Shares
2189,PSFE.W,"Paysafe Limited Warrants, exercisable for one Common Share of Paysafe Limited at a price of $11.50 per share"
2190,PSN,Parsons Corporation Common Stock
2191,PSO,"Pearson, Plc Common Stock"
2192,PSQH,"PSQ Holdings, Inc. Class A Common Stock"
2193,PSQH.W,"PSQ Holdings, Inc. Warrants, each exercisable for one share of Class A common stock at an exercise price of $11.50 per share"
2194,PSTG,"Pure Storage, Inc. Class A Common Stock"
2195,PSTL,"Postal Realty Trust, Inc. Class A Common Stock"
2196,PSX,Phillips 66 Common Stock
2197,PTA,Cohen & Steers Tax-Advantaged Preferred Securities and Income Fund Common Shares of Beneficial Interest
2198,PTY,Pimco Corporate & Income Opportunity Fund
2199,PUK,Prudential Public Limited Company Common Stock
2200,PUMP,ProPetro Holding Corp. Common Stock
2201,PVH,PVH Corp. Common Stock
2202,PVL,Permianville Royalty Trust Trust Units 
2203,PWR,"Quanta Services, Inc. Common Stock"
2204,PWSC,"PowerSchool Holdings, Inc. Class A Common Stock"
2205,PX,"P10, Inc. Class A Common Stock"
2206,PYN,PIMCO New York Municipal Income Fund III Common Shares of Beneficial Interest
2207,PYT,PPlus Tr GSC-2 Tr Ctf Fltg Rate
2208,PZC,PIMCO California Municipal Income Fund III Common Shares of Beneficial Interest
2209,QBTS,D-Wave Quantum Inc. Common Shares
2210,QBTS.W,"D-Wave Quantum Inc. Warrants, each whole warrant exercisable for 1.4541326 Common Shares at an exercise price of $11.50"
2211,QD,"Qudian Inc. American Depositary Shares, each representing one Class A Ordinary Share"
2212,QGEN,Qiagen N.V. Common Shares
2213,QS,QuantumScape Corporation Class A Common Stock
2214,QSR,Restaurant Brands International Inc. Common Shares
2215,QTWO,"Q2 Holdings, Inc. Common Stock"
2216,QUAD,"Quad Graphics, Inc Class A Common Stock"
2217,QVCC,"QVC, Inc. 6.250% Senior Secured Notes due 2068"
2218,QVCD,"QVC, Inc. 6.375% Senior Secured Notes due 2067"
2219,R,"Ryder System, Inc. Common Stock"
2220,RA,Brookfield Real Assets Income Fund Inc. Common Stock
2221,RACE,Ferrari N.V. Common Shares
2222,RAMP,"LiveRamp Holdings, Inc. Common Stock"
2223,RBA,"RB Global, Inc. Common Stock"
2224,RBC,RBC Bearings Incorporated Common Stock
2225,RBCP,RBC Bearings Incorporated 5.00% Series A Mandatory Convertible Preferred Stock
2226,RBLX,Roblox Corporation Class A Common Stock
2227,RBOT,Vicarious Surgical Inc. Class A Common Stock
2228,RBOT.W,"Vicarious Surgical Inc. Warrants, each whole warrant exercisable for one share of Class A Common Stock at an exercise price of $11.50 per share"
2229,RBRK,"Rubrik, Inc. Class A Common Stock"
2230,RC,Ready Capital Corproation Common Stock
2231,RC$C,Ready Capital Corporation 6.25% Series C Cumulative Convertible Preferred Stock
2232,RC$E,Ready Capital Corporation 6.50% Series E Cumulative Redeemable Preferred Stock
2233,RCB,Ready Capital Corporation 6.20% Senior Notes due 2026
2234,RCC,Ready Capital Corporation 5.75% Senior Notes due 2026
2235,RCFA,Perception Capital Corp. IV Class A Ordinary Shares
2236,RCFA.U,"Perception Capital Corp. IV Units, each consisting of one Class A ordinary share and one-half of one redeemable warrant"
2237,RCFA.W,"Perception Capital Corp. IV Warrants, each whole warrant exercisable for one Class A ordinary share at an exercise price of $11.50 per share"
2238,RCI,"Rogers Communication, Inc. Common Stock"
2239,RCL,Royal Caribbean Cruises Ltd. Common Stock
2240,RCS,"PIMCO Strategic Income Fund, Inc."
2241,RCUS,"Arcus Biosciences, Inc. Common Stock"
2242,RDDT,"Reddit, Inc. Class A Common Stock"
2243,RDN,Radian Group Inc. Common Stock
2244,RDW,Redwire Corporation Common Stock
2245,RDW.W,Redwire Corporation Redeemable Warrants
2246,RDY,Dr. Reddy's Laboratories Ltd Common Stock
2247,RELX,RELX PLC PLC American Depositary Shares (Each representing One Ordinary Share)
2248,RERE,ATRenew Inc. American Depositary Shares (every three of which representing two Class A ordinary shares)
2249,RES,"RPC, Inc. Common Stock"
2250,REVG,"REV Group, Inc. Common Stock"
2251,REX,REX American Resources Corporation
2252,REXR,"Rexford Industrial Realty, Inc. Common Stock"
2253,REXR$B,"Rexford Industrial Realty, Inc. 5.875% Series B Cumulative Redeemable Preferred Stock"
2254,REXR$C,"Rexford Industrial Realty, Inc. 5.625% Series C Cumulative Redeemable Preferred Stock, par value $0.01 per share"
2255,REZI,"Resideo Technologies, Inc. Common Stock "
2256,RF,Regions Financial Corporation Common Stock
2257,RF$B,Regions Financial Corporation Depositary Shares Representing 1/40th Perpetual Preferred Series B
2258,RF$C,"Regions Financial Corporation Depositary Shares, each Representing a 1/40th Interest in a  Share of 5.700% Fixed-to-Floating Rate Non-Cumulative  Perpetual Preferred Stock, Series C"
2259,RF$E,"Regions Financial Corporation Depositary Shares, Each Representing a 1/40th Interest in a Share of 4.45% Non-Cumulative Perpetual Preferred Stock, Series E"
2260,RF$F,"Regions Financial Corporation Depositary Shares Each Representing a 1/40th Interest in a Share of Non-Cumulative Perpetual Preferred Stock, Series F"
2261,RFI,"Cohen & Steers Total Return Realty Fund, Inc. Common Stock"
2262,RFL,"Rafael Holdings, Inc. Class B Common Stock"
2263,RFM,"RiverNorth Flexible Municipal Income Fund, Inc. Common Stock"
2264,RFMZ,"RiverNorth Flexible Municipal Income Fund II, Inc. Common Stock"
2265,RGA,"Reinsurance Group of America, Incorporated Common Stock"
2266,RGR,"Sturm, Ruger & Company, Inc. Common Stock"
2267,RGT,"Royce Global Trust, Inc. Common Stock"
2268,RH,RH Common Stock
2269,RHI,Robert Half Inc. Common Stock
2270,RHP,"Ryman Hospitality Properties, Inc. (REIT)"
2271,RIG,Transocean Ltd (Switzerland) Common Stock
2272,RIO,Rio Tinto Plc Common Stock
2273,RITM,Rithm Capital Corp. Common Stock
2274,RITM$A,Rithm Capital Corp. 7.50% Series A Fixed-to-Floating Rate Cumulative Redeemable Preferred Stock
2275,RITM$B,Rithm Capital Corp. 7.125% Series B Fixed-to-Floating Rate Cumulative Redeemable Preferred Stock
2276,RITM$C,Rithm Capital Corp. 6.375% Series C Fixed-to-Floating Rate Cumulative Redeemable Preferred Stock
2277,RITM$D,Rithm Capital Corp. 7.00% Fixed-Rate Reset Series D Cumulative Redeemable Preferred Stock
2278,RIV,"RiverNorth Opportunities Fund, Inc. Common Stock"
2279,RIV$A,"RiverNorth Opportunities Fund, Inc. 6.00% Series A Perpetual Preferred Stock"
2280,RJF,"Raymond James Financial, Inc. Common Stock"
2281,RJF$B,"Raymond James Financial, Inc. Depositary Shares, each representing a 1/40th interest in a share of 6.375% Fixed-to-Floating Rate Series B Non-Cumulative Perpetual Preferred Stock"
2282,RKT,"Rocket Companies, Inc. Class A Common Stock"
2283,RL,Ralph Lauren Corporation Common Stock
2284,RLI,RLI Corp. Common Stock (DE)
2285,RLJ,RLJ Lodging Trust Common Shares of Beneficial Interest $0.01 par value
2286,RLJ$A,RLJ Lodging Trust $1.95 Series A Cumulative Convertible  Preferred Shares
2287,RLTY,Cohen & Steers Real Estate Opportunities and Income Fund Common Shares of Beneficial Interest
2288,RLX,"RLX Technology Inc. American Depositary Shares, each representing the right to receive one (1) Class A ordinary share"
2289,RM,Regional Management Corp. Common Stock
2290,RMAX,"RE/MAX Holdings, Inc. Class A Common Stock"
2291,RMD,ResMed Inc. Common Stock
2292,RMI,"RiverNorth Opportunistic Municipal Income Fund, Inc. Common Stock"
2293,RMM,"RiverNorth Managed Duration Municipal Income Fund, Inc. Common Stock"
2294,RMMZ,"RiverNorth Managed Duration Municipal Income Fund II, Inc. Common Stock"
2295,RMPL$,RiverNorth Capital and Income Fund 5.875%% Series A Term Preferred Stock $0.0001 par value per share
2296,RMT,"Royce Micro-Cap Trust, Inc. Common Stock"
2297,RNG,"RingCentral, Inc. Class A Common Stock"
2298,RNGR,"Ranger Energy Services, Inc. Class A Common Stock"
2299,RNP,"Cohen & Steers REIT and Preferred and Income Fund, Inc. Common Shares"
2300,RNR,RenaissanceRe Holdings Ltd. Common Stock
2301,RNR$F,"RenaissanceRe Holdings Ltd. Depositary Shares, each Representing a 1/1,000th Interest in a 5.750% Series F Preference Share"
2302,RNR$G,"RenaissanceRe Holdings Ltd. Depositary Shares, each representing a 1/1,000th interest in a share of 4.20% Series G Preference Shares"
2303,RNST,Renasant Corporation Common Stock
2304,ROG,Rogers Corporation Common Stock
2305,ROK,"Rockwell Automation, Inc. Common Stock"
2306,ROL,"Rollins, Inc. Common Stock"
2307,RPM,RPM International Inc. Common Stock
2308,RQI,Cohen & Steers Quality Income Realty Fund Inc Common Shares
2309,RRAC,Rigel Resource Acquisition Corp. Class A Ordinary Shares
2310,RRAC.U,"Rigel Resource Acquisition Corp. Units, each consisting of one Class A ordinary share and one-half of one redeemable warrant"
2311,RRAC.W,"Rigel Resource Acquisition Corp. Warrants, each whole warrant exercisable for one Class A ordinary share at an exercise price of $11.50 per share"
2312,RRC,Range Resources Corporation Common Stock
2313,RRX,Regal Rexnord Corporation Common Stock
2314,RS,"Reliance, Inc. Common Stock"
2315,RSF,RiverNorth Capital and Income Fund Common Stock
2316,RSG,"Republic Services, Inc. Common Stock"
2317,RSI,"Rush Street Interactive, Inc. Class A Common Stock"
2318,RSKD,Riskified Ltd. Class A Ordinary Shares
2319,RTO,Rentokil Initial plc American Depositary Shares (each representing five (5) Ordinary Shares)
2320,RTX,RTX Corporation Common Stock
2321,RVLV,"Revolve Group, Inc. Class A Common Stock"
2322,RVT,"Royce Small-Cap Trust, Inc. Common Stock"
2323,RVTY,"Revvity, Inc. Common Stock"
2324,RWT,"Redwood Trust, Inc. Common Stock"
2325,RWT$A,"Redwood Trust, Inc. 10.00% Series A Fixed-Rate Reset Cumulative Redeemable Preferred Stock"
2326,RWTN,"Redwood Trust, Inc. 9.125% Senior Notes Due 2029"
2327,RWTO,"Redwood Trust, Inc. 9.00% Senior Notes Due 2029"
2328,RXO,"RXO, Inc. Common Stock"
2329,RY,Royal Bank Of Canada Common Stock
2330,RYAM,Rayonier Advanced Materials Inc. Common Stock
2331,RYAN,"Ryan Specialty Holdings, Inc. Class A Common Stock"
2332,RYI,Ryerson Holding Corporation Common Stock
2333,RYN,Rayonier Inc. REIT Common Stock
2334,RZB,"Reinsurance Group of America, Incorporated 5.75% Fixed-To-Floating Rate Subordinated Debentures due 2056"
2335,RZC,"Reinsurance Group of America, Incorporated 7.125% Fixed-Rate Reset Subordinated Debentures due 2052"
2336,S,"SentinelOne, Inc. Class A Common Stock"
2337,SA,"Seabridge Gold, Inc. Ordinary Shares (Canada)"
2338,SABA,Saba Capital Income & Opportunities Fund II Shares of Beneficial Interest
2339,SAFE,Safehold Inc. New Common Stock 
2340,SAH,"Sonic Automotive, Inc. Common Stock"
2341,SAJ,Saratoga Investment Corp 8.00% Notes due 2027
2342,SAM,"Boston Beer Company, Inc. (The) Common Stock"
2343,SAN,"Banco Santander, S.A. Sponsored ADR (Spain)"
2344,SAND,Sandstorm Gold Ltd. Ordinary Shares (Canada)
2345,SAP,SAP  SE ADS
2346,SAR,Saratoga Investment Corp New
2347,SAT,Saratoga Investment Corp 6.00% Notes due 2027
2348,SAVE,"Spirit Airlines, Inc. Common Stock"
2349,SAY,Saratoga Investment Corp 8.125% Notes due 2027
2350,SAZ,Saratoga Investment Corp 8.50% Notes due 2028
2351,SB,"Safe Bulkers, Inc Common Stock ($0.001 par value)"
2352,SB$C,"Safe Bulkers, Inc Cumulative Redeemable Perpetual Preferred Series C (Marshall Islands)"
2353,SB$D,"Safe Bulkers, Inc Perpetual Preferred Series D (Marshall Islands)"
2354,SBBA,Scorpio Tankers Inc. 7.00% Senior Notes due 2025
2355,SBH,"Sally Beauty Holdings, Inc. (Name to be changed from Sally Holdings, Inc.) Common Stock"
2356,SBI,Western Asset Intermediate Muni Fund Inc Common Stock
2357,SBR,Sabine Royalty Trust Common Stock
2358,SBS,Companhia de saneamento Basico Do Estado De Sao Paulo - Sabesp American Depositary Shares (Each repstg 250 Common Shares)
2359,SBSW,D/B/A Sibanye-Stillwater Limited ADS
2360,SBXC,SilverBox Corp III Class A Common Stock
2361,SBXC.U,"SilverBox Corp III Units, each consisting of one Class A Common Stock and one-third of one redeemable warrant"
2362,SBXC.W,"SilverBox Corp III Redeemable warrants, each whole warrant exercisable for one share of Class A Common Stock at an exercise price of $11.50"
2363,SCCO,Southern Copper Corporation Common Stock
2364,SCD,LMP Capital and Income Fund Inc. Common Stock
2365,SCE$G,SCE Trust II Trust Preferred Securities
2366,SCE$H,SCE Trust III Fixed/Floating Rate Trust Preference Securities
2367,SCE$J,Southern California Edison Company 5.375% Fixed-to-Floating Rate Trust Preference Securities
2368,SCE$K,Southern California Edison Company 5.45% Fixed-to-Floating Rate Trust Preference Securities
2369,SCE$L,SCE TRUST VI
2370,SCE$M,SCE Trust VII 7.50% Trust Preference Securities
2371,SCE$N,SCE Trust VIII 6.95% Trust Preference Securities
2372,SCHW,Charles Schwab Corporation (The) Common Stock
2373,SCHW$D,"The Charles Schwab Corporation Depositary Shares each representing 1/40th interest in a share of 5.95% Non-Cumulative Perpetual Preferred Stock, Series D"
2374,SCHW$J,"The Charles Schwab Corporation Depositary Shares, Each Representing a 1/40th Interest in a Share of 4.450% Non-Cumulative Perpetual Preferred Stock, Series J"
2375,SCI,Service Corporation International Common Stock
2376,SCL,Stepan Company Common Stock
2377,SCM,Stellus Capital Investment Corporation Common Stock
2378,SCS,Steelcase Inc. Common Stock
2379,SD,"SandRidge Energy, Inc. Common Stock"
2380,SDHC,Smith Douglas Homes Corp. Class A Common Stock
